{
  "nodes": [
    {
      "id": "src/Legacy.App/Legacy.App.csproj",
      "name": "Legacy.App",
      "kind": "console",
      "frameworkClass": "framework",
      "targetFrameworks": [
        "net48"
      ],
      "loc": 15,
      "packageCount": 1,
      "readiness": "blocked",
      "blockers": [
        "src/Legacy.Core/Legacy.Core.csproj"
      ],
      "dependents": 0,
      "directory": "src",
      "cluster": null,
      "inCycle": false
    },
    {
      "id": "src/Legacy.Core/Legacy.Core.csproj",
      "name": "Legacy.Core",
      "kind": "library",
      "frameworkClass": "framework",
      "targetFrameworks": [
        "net48"
      ],
      "loc": 35,
      "packageCount": 0,
      "readiness": "ready",
      "blockers": [],
      "dependents": 1,
      "directory": "src",
      "cluster": null,
      "inCycle": false
    }
  ],
  "edges": [
    {
      "from": "src/Legacy.App/Legacy.App.csproj",
      "to": "src/Legacy.Core/Legacy.Core.csproj",
      "kind": "project"
    }
  ],
  "cycles": [],
  "legend": {
    "frameworkClass": {
      "dual": "#2C7A7B",
      "framework": "#E07A1F",
      "modern": "#2F855A",
      "standard": "#2B6CB0"
    },
    "kind": {
      "console": "box",
      "library": "rounded box",
      "service": "hexagon",
      "test": "dashed rounded box",
      "unknown": "ellipse",
      "web": "tab",
      "winforms": "double box",
      "wpf": "double box"
    },
    "edge": {
      "assembly": "dashed: HintPath reference to another project's output",
      "project": "solid: ProjectReference"
    },
    "cycle": "#C53030"
  },
  "highlight": {
    "mode": "cycles",
    "nodes": []
  },
  "view": {
    "includeKinds": [],
    "excludeKinds": [],
    "focus": null,
    "depth": null,
    "direction": "both",
    "cluster": "none",
    "highlight": "cycles",
    "edges": "all"
  }
}
